<?xml version="1.0" encoding="UTF-8"?>
<StudiosAndCountries xmlns="http://example.com/movies"
                     xmlns:xsi="http://www.w3.org/2001/XMLSchema-instance"
                     xsi:schemaLocation="http://example.com/movies ../schemas/schema-4.xsd">
    <Countries>
        <Country id="country_us">
            <Name xml:lang="en">United States</Name>
            <Code>US</Code>
        </Country>
        <Country id="country_uk">
            <Name xml:lang="en">United Kingdom</Name>
            <Code>GB</Code>
        </Country>
        <Country id="country_fr">
            <Name xml:lang="en">France</Name>
            <Code>FR</Code>
        </Country>
    </Countries>

    <Studios>
        <Studio id="studio_warner-bros">
            <Name xml:lang="en">Warner Bros. Pictures</Name>
            <FoundedYear>1923</FoundedYear>
            <MoviesProduced>12500</MoviesProduced>
            <Location ref="country_us"/>
        </Studio>

        <Studio id="studio_universal">
            <Name xml:lang="en">Universal Pictures</Name>
            <FoundedYear>1912</FoundedYear>
            <MoviesProduced>400</MoviesProduced>
            <Location ref="country_us"/>
        </Studio>

        <Studio id="studio_legendary">
            <Name xml:lang="en">Legendary Pictures</Name>
            <FoundedYear>2000</FoundedYear>
            <MoviesProduced>70</MoviesProduced>
            <Location ref="country_us"/>
        </Studio>
    </Studios>

</StudiosAndCountries>